jfuntszz,Nag trend ang Bastos.  UPLB #Duterte https://t.co/Uea8Dgr9Di
xosigrid,Parang gago yung haters nung UPLB student re: Duterte forum. Magbigay nga kayo ng legit na argument leche
kristine554433,Si Mayor Digong binastos ng isang UPLB student pero kalmado parin si Marimar tinanong lang ng isang taga media naPIKON agad! #PHVoteDuterte
jadine_uplb,"Ahhhhh, my <ed><U+00A0><U+00BD><ed><U+00B2><U+009C> heart's melting. So cute Robert and Alexis <U+2764><U+2764><U+2764> https://t.co/UmpiHYymOU"
landthere,And UPLB is now trending. Ano na ba talaga nangyayari?
rarararanel,UPLB is finally on the trends list
kareneam,tell me more about that UPLB stud issue.
georgialugtu,Hello non-UPLB friend na nagoover react sa issue na hindi man lang pinanood yung video. How dare you say na bastos KAMI LAHAT? Mas bastos ka
MitosDee,@slutsKIEeqn  Wag daw matakot ang mga di kriminal. Sentensyado na si stephen! Pati UPLB. Paktay.
missjover,"Nakaawa ang ginagawa ng mga Duterte fans sa UPLB guy,yan pinalabas n naman na binayaran @uplbperspective @UPLBCDCSC https://t.co/1cTVJ0UsJA"
Ccrizeld,@damienful lol let the entire student body of UPLB bear the consequence for the mistake of one? People are fond of stereotyping. <ed><U+00A0><U+00BD><ed><U+00B8><U+008F>
Paulalalaley,"Nakakabadtrip yung UPLB student, ikaw nalang sana yung tumakbong presidente. Mukhang mas marunong ka pa kay Duterte."
clydeestan,Ang yabang nung student na taga UPLB. Sana nirespeto man lang si Duterte bilang tao
stephenalbertv,Di po ako ung Stephen Villena from UPLB huhu. Dami kong haters bigla :((
clocperez,Nakakainit nga ng dugo yung bata sa UPLB. Parang mas tamang gamitin ang compromise. Di compensate.
AppleJayee,Buti na lang other UPLB students used their sane minds. Bravo to non-Stephen Villena there!
marlouneytunes,Nanahimik ata yung mga UPLB pips na supporters ni Du30. #ChooseASide people oh. #TeamStark lols
jadine_uplb,"VOTE NOW!
My MYX Music Awards 2016 Favorite Female Artist is Nadine Lustre. Vote now! https://t.co/OCkiu7iME1"
MattBorlado,Hay kakahiya you get to go to UPLB using the tax collected from the nation's people tas ganyan ka kabastos. @VillenaStephen
jgecruz12,HAHAHAHAHAHAHA social media pa mowrrrr. Mahal pa rin kita UPLB &lt;3
imsupereli,"uplb = arogante

k po"
theluigibernabe,"When UPLB students are rude to Binay during his visit there, everybody is cool with it."
karenlacuata27,"Sikat na si Stephen Villena 
Sya yung UPLB student na nambastos kay Mayor Duterte 
Naku buti di ka pinahiya at... https://t.co/pYdHvThkwd"
joseffbatoon,"@royehlol pero Mayor sya.... or kahit Normal na  tao lang sya, dapat may respeto paring pinakita ang  uplb man"
razecostales,LOL keyboard warriors thinking they're so smart. ooooooh the sweet sails of irony. tawanan na lang natin yan mga UPLB students.
GellieGalutera,That UPLB student went overboard
MarlNov,"Yung tono palang ng pagtatanong ni Arrogant Man este Stephen Villena, halata mo nang gusto talaga magpasiklab eh. Taga UPLB, lakad makabobo."
slutsKIEeqn,Bakit  feeling ko di na ligtas UPLB after election? Gusto lang naman i-challenge lahat ng candidates <ed><U+00A0><U+00BD><ed><U+00B9><U+0085><ed><U+00A0><U+00BC><ed><U+00BF><U+00BF>
fearlesslightb,Not defending that student cos I know he is really wrong. But I'm against to the du30 supporters who generalize the whole uplb community.
abrieruiz,"So, are you from UPLB? https://t.co/LSjb1yFxcx"
SheenaJoaquin,"pustahan tayo magkakaron na naman ng mga ""AN OPEN LETTER TO"" dahil jan sa #UPLB student issue <ed><U+00A0><U+00BD><ed><U+00B8><U+0082><ed><U+00A0><U+00BD><ed><U+00B8><U+0082><ed><U+00A0><U+00BD><ed><U+00B8><U+0082>"
eyjeytu,"""hindi sasalamin sa 15,000 na populasyon ng UPLB ang sampling size na n=1"""
SerLorasMD,"everybody being offended by that UPLB person because nabastos nya si Digong.

mygod ahhh. ano kayo,  fantards?"
MarvinFlores23,Paano kaya hindi si Duterte yung binastos ng nung UPLB student what if si Roxas un or si Binay sure ako tatawa lang yung mga tao
theandreross,"Pag si Binay binastos ng mga tiga UPLB, everybody cheers. Pag si Duterte, everybody loses their shit. I don't get it."
GeraldEmld,"Trending ""UPLB"" sa Twitter HAHAHAHAHAHAHAHAHAHAHAHAHA"
jadine_uplb,"REMINDING EVERYONE TO VOTE!
My MYX Music Awards 2016 Favorite Artist is Nadine Lustre. Vote now! https://t.co/OCkiu7iME1"
gerhardp1991,Hmmm.... UPLB
Nelleyhats,@ohannaaamarie Good point though but maybe because at first the student is still unnamed and all info the netizen had is he's from UPLB.
unGelo_,"According to one post of an alumni of UPLB, the name of that rude b****** is Stephen Villena. <ed><U+00A0><U+00BD><ed><U+00B8><U+00A1>"
apriloblepiasss,Off to uplb haha
WHOBOUGHTWHOBUD,Bastos na UPLB Student all over my feed lagot!!!
abasoloRMC,@kittikittkitt ang na butang sa Rappler kay instead na si Stephen Villena lahi ang tao hahahaha pero mao gyud ni ang UPLB - Man haha
jadine_uplb,My MYX Music Awards 2016 Favorite Song is Me and You. Vote now! https://t.co/OCkiu7iME1
Froliloise,"UPLB kid: ""Makakabili ng mahal na baril without compensating the budget for education"". It's compromising, kid, and not compensating."
jadine_uplb,My MYX Music Awards 2016 Favorite Music Video is Me and You. Vote now! https://t.co/OCkiu7iME1
jhonybaloney,"I pushed studying in UPLB pra makapgtrans sa Diliman pero putangina, ELBI is lyf!!! <U+2728> punta ka dto dre pra mafeel mo https://t.co/Bf4rTTVqZY"
danpedrosa2,Naluoy ko gamay ating taga UPLB
jhubielyng,lol at the people demanding for respect when they themselves aren't; talk about irony and hypocrisy #uplb
pjsiasat,"Cut him some slack for God's Sake. Stop cyber-bullying the kid. Duterte handled it calmly, why can't you? #UPLB"
ashangfrxnceska,"yung mga taga-UPLB na kilala ko, mahihilig talaga sumabat at mangatwiran kahit mali, may masabi lang <ed><U+00A0><U+00BD><ed><U+00B8><U+0082>"
RoyehLOL,"Saludo ako sa UPLB student na kayang magtanong ng diretso kay Duterte. Tama lang naman yung ginawa nya e. DIBA NGA, KANDIDATO SI DUTERTE!"
kiegonpijera,"wag naman sana lahatin ang estudyante ng UPLB.
meron din namang matitino. #Duterte2016"
mynameisjea,Enjoying all the grilling and bashing aimed towards this ignorant and rude UPLB stud. He deserves it <ed><U+00A0><U+00BD><ed><U+00B1><U+008F><ed><U+00A0><U+00BC><ed><U+00BF><U+00BB><ed><U+00A0><U+00BD><ed><U+00B1><U+008F><ed><U+00A0><U+00BC><ed><U+00BF><U+00BB><ed><U+00A0><U+00BD><ed><U+00B1><U+008F><ed><U+00A0><U+00BC><ed><U+00BF><U+00BB>
MarkyMall,Duterte slays the question of a UPLB student.
ChrisBcCIntosh,my tita graduated from UP diliman yet she was disgusted  looking at the arrogant UPLB student
iamJurizaAnne,"Kung gusto mo ng madaliang pag sikat, tularan si Stephen Villena ng UPLB <ed><U+00A0><U+00BD><ed><U+00B8><U+0082>"
kristine554433,@Duterte24x7 si PASIKAT MAN UPLB Student na nag mamagaling
JoshLabis,I cant believe some students on twitter actually defend the UPLB student who disrespected duterte..
BoomPANGA,Wala namang kasalanan yung UPLB mismo. Sadyang naglipana nalang talaga kung sasaan ang mga bastos na kabataan. #Duterte2016
iyaelago,@Yaaaaaannnnnnn (1) That you shouldn't be lose your manners towards the UPLB community just because some guy lost his and (2) that
damienful,@Ccrizeld because they can as one UPLB student criticizes the whole of Duterte. #charot
sabinoariesxxiv,"Sira ulo kang estudyante k ng UPlb bumastos ka duterte , pag kapakita kasken sapak k sken!"
ClairDelevingne,"Much has been said to that UPLB stud. Anyway, everyone's entitled to his or her own opinion."
LoveHaniBee,May bagong cyberbullying na naman. Yung student ng UPLB na binastos daw si Duterte. Sus! OA niyo! Tigilan niyo pamamahiya sa kapwa niyo.
heavendomingo_,that UPLB kid tho. pft
she8happens,UPLB Perspective lang siguro pagkakatiwalaan ko sa balita.
she8happens,UPLB Perspective nalang pagkakatiwalaan ko sa balita.
rentsu09,Atleast that UPLB student is now scarred for life <ed><U+00A0><U+00BD><ed><U+00B8><U+0082>
Athenerd,Hala wait anyare ba't po binabash kaming UPLB students ano meron gawa ba nung nangyari nung kay Duterte hala
ErckOms,Kaurat tong student ng UPLB. Matalino kaso yung attitude.
AriZlangSs,to UPLB student na nambastos.. kung ayaw mo kay Mayor Duterte dapat tumahimik ka nalang sana.
rentsu09,HAHAHA tangnang UPLB student na yun ang labo ng tanong.
soedakyoko,Nakakainit na ng ulo 'yung mga sinasabi about UPLB students. Gravity. <ed><U+00A0><U+00BD><ed><U+00B9><U+0083> #DuterteVisitsUPLB.
JustGwapo,"Apparently, those UPLB students didn't brought manners with them during Duterte's visit. Such a disgrace for UP. <ed><U+00A0><U+00BD><ed><U+00B8><U+008F> https://t.co/G2oYQV3DGm"
elaysensaypiyel,Letran or UPLB <ed><U+00A0><U+00BD><ed><U+00B8><U+008C> https://t.co/vlPzbqDQVY
nj_unson,wow trending uplb haha
francismagsajo,"I think people forgot the main issue on Duterte vs UPLB Student. Oh but then again:

Ano nga ba ang relevant na issue talaga?"
PapaLowps,"Di ko parin talaga gets kung bakit issue yung UPLB student. Di naman sa bastos, pero si Duterte pa ba yung hindi sanay makarinig ng ganun?"
ako_othy,Sa sobrang bilib mo sa sarili mo simpleng GMRC lang di mo mapairal sa sarili mo UPLB Student vs. Mayor Duterte <ed><U+00A0><U+00BD><ed><U+00B8><U+00A4><ed><U+00A0><U+00BD><ed><U+00B8><U+008F>
tenderjuicyyy,Nagagalit kayo dahil nilalahat ang mga UPLB students pero ginagawa nyo rin naman. Hypocrites
NolMontalbo,"#Duterte vs ""UPLB-Man"".
Una sa lahat, utoy, the word should be ""compromised"", not ""compensate"".ﾅ https://t.co/lv8gIeBtxM"
akositurat,Oh UPLB days. Napareminisce tuloy :D
kleyr_agbayani,myOpinion!! naiinis ako sa UPLB student... bastos napaka basto. parang walang pinag-aralan! kung ikaw kaya nasa sitwasyon ni #Duterte . #LR
renzorodelas,"Nakakatakot, baka mawala na lang bigla si kuyang binubully ng dutertards :((( Ano na naman labas ng uplb sa media <ed><U+00A0><U+00BD><ed><U+00B8><U+0094>"
MitosDee,"@galangir   Sabagay nga. Di pa nakakasagot si mayor, dinedebate na ni stephen. Pasaway sya. Di po UPLB."
MSJLeyson,"May mali naman talaga si Isko, hala pero naman, hindi sasalamin sa 15,000 na populasyon ng UPLB ang sampling size na n=1 (Penuliar, 2016)"
akosileann,sobrang nakakabadtrip ang tweets sa UPLB.. mga stereotype!
joshuasulpico1,Ito ung pambabastos kay duterte ganun pala mga taga UPLB bkt ba pinoproblema nyo ung pilipinas hnd nyo... https://t.co/Tg9xNcMVAQ
chumpaddy,After watching the Q&amp;A sa UPLB... https://t.co/640g4VBVRW
bigoteeswabe,Puro about dun sa issue nung UPLB  student laman ng news feed ko
dextercruzat,He didn't gave us direct answers. - UPLB students observed // Si Duterte ang tipo ng tao na magbibigay muna ng example bago ang paliwanag.
wielsonf,"Kapag taga-UP o UPLB ka, hindi mo na kailangang depensahan ang sarili mo kung nasa tama ka. You've got a large community behind you."
Ashee0315,Kaya nman pla gnun nlng si Stephen Villena mambastos eh pkawala ni Roxas! May bayad sya! Kakahiya damay pati UPLB https://t.co/Idz17HD8oN
Jeffrey413_,UPLB wala manlan kayong gagawin dun?
akosileann,grabe mas masahol pa kayo dun sa UPLB Student na sinasabihan niyo ng bastos. kakahiya kayo.
bebot_me,"@bebot_me duterte uplb That student demanded straight answer,yet his question was long and winding. Simply rude!"
iRHEAplaceable,"UPLB better check your students for the sake of your school, &amp; here I thought that all the smart ones go to UP, guess I was wrong."
aQcGlenTot,Stephen villena ikaw ang halimbawa ng walang modong bastos UPLB ka pa naman!... alagad ka nga ng mga abnormal sambahin mo si PNOY at ROXAS
DaniloA64203375,@clavenilo @1nutty_hazel @nems5669 tama kayo mga UPLB students.@NO TO BBMARCOS. Beware of Duterti and GPoe also BINAY.this a warning b4 regr
GenderBenderPH,Eto si Stephen Villena ng UPLB ang bastos na nagtanong kay Duterte. Parang galing hukay ka bro hahaha <ed><U+00A0><U+00BD><ed><U+00B6><U+0095><ed><U+00A0><U+00BC><ed><U+00BF><U+00BB><ed><U+00A0><U+00BD><ed><U+00B6><U+0095><ed><U+00A0><U+00BC><ed><U+00BF><U+00BB><ed><U+00A0><U+00BD><ed><U+00B6><U+0095><ed><U+00A0><U+00BC><ed><U+00BF><U+00BB> https://t.co/nTf8SSCloD
annoyinghoey,or bastos din si student pero hindi siya representation ng buong uplb <ed><U+00A0><U+00BD><ed><U+00B8><U+008C>
jomardlrs,Naturingang taga UPLB ka pero di ka marunong makipagusap sa matanda ng tama.
wilmooooor,"A UPLB student roasts Binay - Meh
A UPLB student roasts Duterte - ""Bastos. Dapat turuan ng magandang ugali"" https://t.co/8N1BIRA6av"
dextercruzat,Goodluck na lang sa'yo @VillenaStephen pati UPLB nadamay sa'yo. Hahahah! #PHVoteDuterte
dearestdaryl,"[korina sanchez' voice] Imahen ng Banal na Birhen, tinakpan ng itim na tela ng isang kulto sa UPLB.
[mariang_banga_women's_day.jpeg]"
akosileann,ano namang meron sa UPLB? grabe ano? stereotyping na
joeseffpinto,"""Maling mali ang estudyante na taga UPLB, respeto naman daw."""
abasoloRMC,AAAAH kaya pala mayroong UPLB-MAN hahahaha
katreenanulud,but ok wtf?? enlighten me about the uplb/duterte situation pls
rinagoddethe,A rotten fruit around the good ones can affect others too. What should we do? UPLB
bumblebest,"Eating popcorn while reading UPLB comments in the TL. Pot meet kettle lang yung nangyari, people calling someone rude rudely."
aQcGlenTot,Stephen Villena naaawa ako sayo dahil lumaki kang bastos uplb ka pa naman nag-aaral #respectd30 #d30  #digong ibalik ang GMRC
acupanpat,"para sa'kin, that UPLB student went beyond expressing his opinions. I'm not a fan of Duterte but i believe he deserves to be respected."
kristine554433,PASIKAT MAN or ARROGANT MAN?UPLB student na nag mamagaling!Libag na tinubuan ng Mukha! #PHVoteDuterte https://t.co/GLVbo20Ng6
Ccrizeld,Why are they criticizing all the students of UPLB?
iRHEAplaceable,Kay kuyang taga-UPLB. WALA KA NA NGANG IQ WALA KA PANG EQ. Kahiya ka. Sayang binabayad kong TAX at ng mga magulang ko para mapaaral ka. <ed><U+00A0><U+00BD><ed><U+00B8><U+00A4><ed><U+00A0><U+00BD><ed><U+00B8><U+00A4><ed><U+00A0><U+00BD><ed><U+00B8><U+00A4>
attyzcb,@certifiedsonny there was someone who said that from UPLB? #Emperor'sNewClothes
BromanceManila,Duterte is 'unpresidentiable'. He didn't gave us direct answers. - UPLB students observed
MissQiqai,"Sa bastos na UPLB student na nagtanong kay Duterte:
hijo, bago ka magAngas, balik ka muna sa English101. Baka COMPROMISE, hindi compensate."
bimboy_palaboy,"Q&amp;A pressed for time. Duterte's reply long-winded. UPLB student asks for direct answer. 

Ayun, chinorvah siya ng keyboard warriors. #NKKLK"
kylejosef,Bastos yung crush ko from UPLB kasi hindi niya ako crush. Hayst grabe ka wala kang respeto sa feelings ko.
jshcasti,ganyan ba mga taga UPLB @megcabs HAHA
iRHEAplaceable,Yung sa pambabastos ni kuyang taga-UPLB kay Mayor talagang jusmiyo! Nag aral ba to ng GMRC?
sabadooow,uplb vs. ph
MkLuwal,Sana maturuan ng maigi ng upLB.  https://t.co/Gtzsfg4Vj2
sadtambay,"bbastos tlaga ng mga taga uplb na yn ... di man lan ako pinasa , ginawa ko nman best ko sa upcat ?!!"
jadine_uplb,@HitganoMae Alumni and students din po <U+263A>
dearestdaryl,"Umagang Kay Ganda Headline: 

Mga sikat na banda, nakisaya sa UPLB Feb Fairmotorsiklo at tatlong truck, nagkarambola sa EDSA."
jshcasti,savaaaage uplb student HAHAHA
GWENchanha,"Hindi ko alam yung exact na nangyari nung forum, but please, wag nyo naman sana sabihing bastos LAHAT ng UPLB students."
jelliyace,"I'm not for duterte but that UPLB student really went overboard. Konting respeto lang, koya."
jadine_uplb,"@kylaxxvii Thank you! All for the love, JaDines <ed><U+00A0><U+00BD><ed><U+00B8><U+0098><ed><U+00A0><U+00BD><ed><U+00B8><U+0098><ed><U+00A0><U+00BD><ed><U+00B8><U+0098>"
Lenard2404,Nagtrending #UPLB dahil dun sa lalaki HAHAHAHHA
marjyxox,Grabe kabastos atong UPLB student uy. Wala siya kaila sa iyahang gisturyahan siguro. Kaluoy
johnarvinjavier,and UPLB is trending
theIRISistible,"Every time mag open ko fb and may discussion about the UPLB issue, always gid may comment nga UP students are bastos. Nekekebedtrip ne he <ed><U+00A0><U+00BD><ed><U+00B8><U+0092><ed><U+00A0><U+00BD><ed><U+00B8><U+0091>"
imsupereli,"Ayan, trending na uplb. Again."
dextercruzat,Trending na ang UPLB dahil ni Stephen Villena na BASTOS. Tanggalin yan sa UP dapat!!!
IAMRGNF,Ayoko na magbasa ng tweets sa trend ng UPLB. Daming conyong bandwagon bashers.
damienful,"Thank god Duterte did not go berserk over that kid in UPLB. He stayed calm and jokingly said, ""bomba na lang"". Sana kayo rin chill. #charot"
NivramzDL,"@VillenaStephen Stupid asshole! Ikinakahiya kana ng buong UPLB community.
Wala kang alam."
razecostales,Relax UPLB students. Let them say what they want. https://t.co/4DwYqs9qJp
jeriberlyn,"nakakastress yung issue dun sa pagvisit ni Duterte sa UPLB, pati sa Saudi nakarating"
juncobalmeo,"People getting mad at this UPLB student for being ""bastos"" by also being ""bastos"" and wishing him dead. Irony at its finest! #Duterte"
Flyhighpau,"i just cant believe that people choose sides with this uplb student vs duterte 

eh kung si binay yung ginigisa lalo niyo pang gigisahin"
AppleJayee,Agree! He put a bad name to the whole school. Im sorry UPLB. Why have a student like him. https://t.co/y5w7tk6Viq
clintzoned,"kapit lang maga kaisko/kaiska ng UPLB, katuwang natin si stat1"
NINJAYEWOLF,"duterte: started with point-leaving answer

uplb student: impatiently asked for a direct answer.

netizens: scolds him with foul words."
direkJohndr,Wala akong maisip na worst adjective sa taong ito na taga #UPLB pa man din. Don't us! <ed><U+00AE><U+00B8><ed><U+00BC><U+00B4><ed><U+00AE><U+00B9><ed><U+00B3><U+00B5> https://t.co/JdCR9l8QJK
IAMRGNF,UPLB Protection Squad <ed><U+00A0><U+00BD><ed><U+00B8><U+0082>
dyosanna_,Sikat na naman ang UPLB dahil sa bash. <ed><U+00A0><U+00BD><ed><U+00B8><U+0091><ed><U+00A0><U+00BD><ed><U+00B8><U+0091><ed><U+00A0><U+00BD><ed><U+00B8><U+0091>
hyacinth_aubrey,"Aanhin ang katalinohan kung arogante, bastos at mayabang. Buti pa si Carrot Man kahit High School lang pero wagas naman kung gumalang. #UPLB"
juncobalmeo,"Come on! We all know that UPLB student got way too arrogant. So what? He should be dead for that? If #Duterte handled him calmly, why cant u"
dearestdaryl,"[korina sanchez' voice] isang dormitoryo sa UPLB, pugad, raw, diumano ng mga demonyo [intro scary music] [low-budget pagsasadula in sepia]"
itoced,Many are educated but few are well mannered. #UPLB
fun2Bjary,here's the truth behind the UPLB and Duterte incident https://t.co/N8LoZU0DLe #ABSCBNLOSTCAUSE
Zanderyael1,This UPLB student is an idiot . if duterte wins . its a big slap on your face ! UPLB MONKEY
maryrainman,1 of d reasons kaya gusto natin si du30 ay dahil ayaw natin ng krimen but yung ibang supprters kung makapagthreat dun sa uplb student ang oa
Michaeldaavss,Hahaha qt pinaguusapan yung student from uplb
Tiantiaaaaaan,Next time si Mar Roxas naman ipadala niyo sa UPLB! <ed><U+00A0><U+00BD><ed><U+00B8><U+008F>
IceLavilla,Bakit yung buong UPLB yung pinag-uusapan tho? Such generalizations.
MkLuwal,I thought upLB was a school.
anniesthesiaaaa,"Gusto lang masagot nang direct nung UPLB student yung tanong niya kay Duterte, rude na ba yon? Hays"
camillegalope,@angeligalope hahahaha as in ses! Akong feed napuno ug video atong q&amp;a sa tga UPLB.
myelski,"""""shet!!! trending ang uplb wooh pr0uD 2 be isk0"""""
ABETyouknowme,Educated but not well mannered. @VillenaStephen kahihiyan sa UPLB at sa magulang niya.
marcrimon,That UPLB student is like the fly you can never catch; annoying.
certifiedsonny,labasan ang mga #duterte supporters ah. bash nyo yung uplb student stephen villena na nagtanong kay duterte.
coconalang,UPLB all over mah timeline
kkktine,here comes the bandwagon effect in the UPLB issue.
crcmarquezmd,"The stupid and arrogant boy from UPLB was not able to handle the consequences of his stupidity, deactivated his... https://t.co/sjXkGMTjfx"
BinsentL,"Dad: ""What's your stand againts the UPLB issue?""
Me: ""you might wanna sit down"" <ed><U+00A0><U+00BD><ed><U+00B8><U+008A>"
whatshouldisay_,"To that rude &amp; arrogant UPLB student na nagtanong kay Duterte: 
Good luck na lang sa buhay, boy. Ganyan talaga kapag akala mo kung sino ka."
dearestdaryl,"ABSCBN HEADLINE: UPLB CommArts Student ""chill AF"" during his well week; says Kopiko 78ﾰc ""saved his life"". bit.ly666ulol"
lykaaaaaaaa_,Ba yan <ed><U+00A0><U+00BD><ed><U+00B8><U+008F> Gustong gusto ko nga bumalik ng UPLB e <ed><U+00A0><U+00BD><ed><U+00B8><U+008F>
jppenuliar,"May mali naman talaga si Isko, hala pero naman, hindi sasalamin sa 15,000 na populasyon ng UPLB ang sampling size na n=1. <ed><U+00A0><U+00BD><ed><U+00B9><U+0084>"
hyacinth_aubrey,Ganito kaming mga supporters ni Duterte kasi dito sa Mindanao nirerespeto at mahal yan si Mayor tapos ginaganyan ganyan lng ninyo? #UPLB
kstansarang,UPLB. breeding ground for activists and leftist.
SefTerencio,fuck that UPLB guy. Fuck him and his parents. Lol
iamvanessaaa,Natatawa ako sa sagot ni Duterte dun sa uplb student bomba na lang daw buset hahahaha <ed><U+00A0><U+00BD><ed><U+00B8><U+0082><ed><U+00A0><U+00BD><ed><U+00B8><U+0082>
clintzoned,trending ang UPLB. ang cute
MajhoyNueva,Ang kapal ng mukha ng isang estudyante ng UPLB para bastusin c mayor duterte.. Nakakahiya ka.. D marunong rumespeto
JysnMnl,Seriously? UPLB student -_-
HaroldJayR,Kung si Binay to g ingn ato sa UPLB. Sure ko daghan naas side sa student. Respect lang unta sa tanan candidates <ed><U+00A0><U+00BD><ed><U+00B1><U+008D><ed><U+00A0><U+00BD><ed><U+00B1><U+008D><ed><U+00A0><U+00BD><ed><U+00B1><U+008D>
jadine_uplb,"Head over heels in love be like: FROM PUYO TO BURLINGTON SOCKS <ed><U+00A0><U+00BD><ed><U+00B8><U+0082><ed><U+00A0><U+00BD><ed><U+00B8><U+009C><ed><U+00A0><U+00BD><ed><U+00B2><U+009C>

REIDY SET SLIME
#SweepMyxForNaddie  https://t.co/S5XMw3OoaY"
SsanBartZ,@carlothewacko i am looking forward to see ur candidate Mar roxas to go ro UPLB as well
ptrcvllbr,trending yung uplb
myelski,uplb students be eating hasty generalizations for bfast
dlorentzfactor,HOT TAKE: The commenters came off as more rude than the UPLB kid questioning Duterte.
nicotinehayel,UPLB trending. Is this because of the Duterte x rude student issue? meh!
4Duterte,"Stephen Villena, as a Duterte supporter, I dont hate as a person coz I dont knw u personally, its just sad u put UPLB in a bad light."
seven_kathleen,Grabe naman yung student from UPLB <ed><U+00A0><U+00BD><ed><U+00B8><U+0092><ed><U+00A0><U+00BD><ed><U+00B8><U+0092>
IamKarlalicious,UPLB Man? <ed><U+00A0><U+00BD><ed><U+00B8><U+0082> Pang-tapat daw kay Carrot Man? Eh kung tutuusin mas okay pa si Carrot Man kesa kay UPLB Man. <ed><U+00A0><U+00BD><ed><U+00B8><U+009C> #UPLB #StephenVillena
jadalgncastillo,"My say regarding sa ""pambabastos"" ng UPLB student by RAPPLER:

Yung ""kabastusan"" ni Duterte, try nyo pansinin once para fair tayo. Smile. :)"
juuckiboks,oh trending na naman UPLB
tsareees,Nasobrahan ng bayag yung UPLB student na beastmode kay Duterte. Hahahaha
shetsette,Good morning! Ahihi ganda na naman image ng uplb ha hmmmmm =-)
_jennzky_,UPLB <ed><U+00A0><U+00BD><ed><U+00B8><U+0091><ed><U+00A0><U+00BD><ed><U+00B8><U+0091><ed><U+00A0><U+00BD><ed><U+00B8><U+0091><ed><U+00A0><U+00BD><ed><U+00B8><U+0091>
gettedomingo,IT'S UPLB AGAINST THE PHILIPPINES OLRAYT
yzagurl,Watching #duterte2016's interview at #UPLB. <ed><U+00A0><U+00BE><ed><U+00B4><U+0094>
lumacob,@Chino_Pipino @4Duterte RIP UPLB https://t.co/ZILrn40cus
mhilchristym,hala oy ngano man tong taga UPLB bzzzt
hopeyraj,Trending ang UPLB.
IamBiaaancaaaa,Ui bakit trending UPLB? Ano ba ganap?
Duterte24x7,Presidential candidate Rodrigo Duterte was disrespected by a student from UPLB! | https://t.co/0l3f7vH4ys #PHVoteDuterte
camillequinones,"baka naman may political party na sinusupport yung uplb student kaya ""nambabastos"" ng ibang kandidato?"
purrferfur,"Grabe. Ang utak talangka naman nung UPLB student na yun, kainis, di magets"
iyatrinidad,@iyatrinidad What this UPLB student did was so low. Wala niya g-isip sa iyang mga gpang-ingon. may masabi lang and para maingnan bright lol
crcmarquezmd,Duterte was able to handle tough questions. But the question made by the UPLB student was not tough at all. The... https://t.co/Unm9M480VZ
BurgerKingLee,Kairita yung student ng UPLB <ed><U+00A0><U+00BD><ed><U+00B8><U+00A4><ed><U+00A0><U+00BD><ed><U+00B8><U+00A4> di lahat ng nasa UP matalino simpleng pag tahimik lang habang sinasagot yung tanong di kaya
ItsCindyIsrael,Trending talaga yung taga UPLB eh.
kainoax,@NONONOYOUTHH gusto ko yung logic na parang napaka-insular ng uplb for the admin to intervene
pvmsii,Tried reading the comments about UPLB students regarding the Duterte issue. Nakaka-frustrate. <ed><U+00A0><U+00BD><ed><U+00B8><U+00A7><ed><U+00A0><U+00BD><ed><U+00B8><U+0095><ed><U+00A0><U+00BD><ed><U+00B8><U+0091>
ryanrites,Nanggigigil ako!!! Masyadong nagmamarunong 'tong UPLB student na 'to<ed><U+00A0><U+00BD><ed><U+00B1><U+008A><ed><U+00A0><U+00BC><ed><U+00BF><U+00BB><ed><U+00A0><U+00BD><ed><U+00B1><U+008A><ed><U+00A0><U+00BC><ed><U+00BF><U+00BB>Si Duterte pa talaga ginago mo.
jonelmico,"In 3-6 months, lagot yung student from UPLB. Jkk <ed><U+00A0><U+00BD><ed><U+00B8><U+009D>"
iyatrinidad,"@iyatrinidad -- intelligent than Digong. wala na sya naulaw? lol pathetic jd kaayo sya. He just humiliated his school, UPLB <ed><U+00A0><U+00BD><ed><U+00B8><U+008F><ed><U+00A0><U+00BD><ed><U+00B8><U+008F>"
kimtappy,Ayoko ng maging uplb student magaaudition nalang ako sa star magic hahaha jk
beorvb,Hala trending ang UPLB at Stephen Villena <ed><U+00A0><U+00BD><ed><U+00B8><U+00B1>
ItsSamGonzaga,Ang pangit na ng name ng UPLB dahil dyan kay Stephen Villena. Hays
Mike_Angelo30,"Teacher Gelo's Blog: Rodrigo Duterte, Confronted by a UPLB Student Step... https://t.co/MEvUJ3dqZC"
itsDisaJ,Not everyone who studies in UPLB is a well educated person. <ed><U+00A0><U+00BD><ed><U+00B8><U+008A>
pauldelfin_15,merese ning taga UPLB na si Stephen.. gaba mga tao nay ni bash nimo sa pagkabastos hahaha meresedetii
