ljaemarie,Buguon ning UPLB na studyanteha ni ha!
faitth14,"I came across this ""Di pala lahat ng UPLB Matalino"". Well at the back of my mind, Judgemental talaga ng Pinoy nowadays. #DuterteVisitsUPLB"
rommeeeeel,that uplb student has nothing to say like bitch how rude can u get?
jomlabayen,Bilib ako dun sa batang #UPLB na derecho magsalita.
jaayyysss,That dumbass UPLB student <ed><U+00A0><U+00BD><ed><U+00B8><U+0092><ed><U+00A0><U+00BD><ed><U+00B6><U+0095><ed><U+00A0><U+00BC><ed><U+00BF><U+00BC>
derickbidaswa,ngayon ko lang napanood yung issue about kay duterte and dun sa student ng uplb. WOAH!! Haahaha
ggvasuu,Duterte: Some questions at UPLB forum were ﾑa bitﾠsillyﾒ https://t.co/U9PwvT0kn0 https://t.co/l0tHgH2CaX
NINJAYEWOLF,Philippines needs more UPLB students.
levineduanan,"Rude UPLB student? More like over-sensitive, self-righteous peenoise. #huhupinas"
elainemars,"Yung trending sa Facebook ang UPLB dahil sa sobrang arrogante ng estudyante nila... Tsktsk. UP alum here but yeah, arrogance is sh*t."
sindihands,Sa kuyang taga UPLB na trending na dahil sa disrespectful acts nya against Duterte: HINDI MO KINATALINO YAN. #justsaying
aikamaruu,Mej harsh nga magtanong yung student ng UPLB na medyo nakakabastos sa tingin ng iba pero feeling ko may point din siya sa way ng pagtatanong
JetMonticello,Pati si Duterte ginisa ng mga UPLB students. #DUTERTE2016 pa rin ba?
kachakabells,Tell that UPLB student that police is not under defense.and educ budget is not only for UP.may mga public elementary and high school pa
theaspoons,"That uplb student vs duterte thing, idk what to feel"
josnar_dionzon,Socrates had interesting interlocutors compared to the ones encountered by Mayor Duterte in UPLB.
Eddiiiiiii,@ja_fernandez @AFFS_UPLB sheeet huhuhu sorrryyy :((
markdtrinidad,May paopen letter pa si kuyang uplb student haha
thatgirlnikka,"*watched Digoy's UPLB forum*
*read the comments*
*wrote own opinion*
*grabs popcorn*"
UPLB_MASS,"Heyday (Alumni vs Residents) was held yesterday at Pansol Covered Court. Thank you, MASStig! <U+2764><U+2764><U+2764> https://t.co/BbjCMBAAYj"
joshuasilvaaa,Ang bastos magsalita nung estudyante ng UPLB kay duterte.
UPLB_MASS,"To all BS Math, BS AMAT, BS ComSci, BS Stat, and BS MST major in Math,

We are now accepting applicants! <U+2764><U+2764><U+2764> https://t.co/9GaL4S5YlG"
jovelyn_n,Duterte: Some questions at UPLB forum were 'a bit silly' https://t.co/cByQOxresF
Eddiiiiiii,"@ja_fernandez @AFFS_UPLB Halaaaaa, ate ja bakit ""&lt;/3""? hahaha?"
shootsomefar,Ayoko na sanang mag-react re: UPLB student kasi di ko naman alam context ng tanong niya why he asked kung... https://t.co/vN7lzHXuyp
signmeupsantafe,It's cute how Duterte's supporters accused UPLB students of being 'disrespectful' after listening to him cursing all throughout his speech.
anneddyy,Wait lang footspa nabeast mode ako dun sa UPLB student.
Eddiiiiiii,#AFFSaya <ed><U+00A0><U+00BD><ed><U+00B8><U+008A> <ed><U+00A0><U+00BD><ed><U+00B2><U+0095> <U+2728><ed><U+00A0><U+00BC><ed><U+00BC><U+00B1><ed><U+00A0><U+00BD><ed><U+00B1><U+00AA> @AFFS_UPLB https://t.co/giddW7i1Ud
droowee,"Ano ba pinaglalaban nitong estudyante ng #UPLB?? Sinabi nga na biggest budget will go to education, ano hindi mo naintindihan dun indio ka."
meihime,UPLB pips go! Ang galing mo manggisa. Gujab on questioning D30
desiree2ne1,"Oh @rapplerdotcom &amp; to all UPLB students iniisip pa kayo ni #PHVoteDuterte ayaw kayong ipahiya #DuterteVisitsUPLB
https://t.co/Vl0dnITiRz"
jasonbanac,That uplb student tho. Shallow af. <ed><U+00A0><U+00BD><ed><U+00B8><U+0082>
iPapsieDy,Ang bastos ng estyudanteng yun.  Is he really from UPLB?!  Pasikat!
sw33t2u,MAG ASTA IBANG ESTUDYANTE SA UPLB KALA NILA SILA ANG PINAKAMAGALING! BULLSHIT! <ed><U+00A0><U+00BD><ed><U+00B8><U+00A1><ed><U+00A0><U+00BD><ed><U+00B8><U+00A1> https://t.co/4fpkUGvDCE
TheNeilNotado,That UPLB student who disrespectfully asked Duterte is one of many people who thinks they know everything.
jiangenovana,"That UPLB student who disrespectfully asked Duterte is one of many people who really deserves online humiliation. That's what you get, kid."
sw33t2u,SOME UPLB STUDENTS MAKE A FOOL OUT OF DUTERTE! A LOT OF GRADUATES FROM UPLB THAT RULE DIFF GOVT AGENCIES OF THE PH. EH NGAYON ANG PINAS? BS!
yoongikink,jusko punong puno ng hasty generalization ang timeline ko. nag-disagree lang sa isang taga UPLB buong UPLB agad damay
ByMatteshall,"Hey UPlb kid, that's not being brave, radical, RATM mentality, certainly not confidence. That's rude and it shows you're just a brat."
kachakabells,"@thirdyglino no, that UPLB student asked a question but was not prepared to listen to an answer and interrupted duterte."
bmrhernandez,Duterte can toast that UPLB student right there on the spot but he chose not to. That kid should consider himself lucky.
sillysassycee,'yung estudyante'ng taga uplb ang halimbawa ng daig ng may respeto ang matalino! :D
jadine_uplb,"Go go go! 

REIDY SET SLIME https://t.co/xopNY9awr2"
eabaguioro,#Duterte will never convince the UPLB Students to support him instead of Miriam.  Hey're too SMART to be... https://t.co/94m11jHguh
4Duterte,We're sorry that UPLB students have to go through this just because of Stephen Villena. https://t.co/we25ac4cJU
duterte007,"MAKA MAR PALA YUNG ARROGANT UPLB STUDENT NA NAG TANONG KAY MAYOR DIGONG.
#friendshipsaanakniLeni

#PHVoteDuterte https://t.co/dBiYET17ZS"
duterte007,"MAKA MAR PALA YUNG ARROGANT UPLB STUDENT NA NAG TANONG KAY MAYOR DIGONG.
#friendshipsaanakniLeni

#PHVoteDuterte https://t.co/FEiRHrBbn7"
duterte007,"MAKA MAR PALA YUNG ARROGANT UPLB STUDENT NA NAG TANONG KAY MAYOR DIGONG.
#friendshipsaanakniLeni

#PHVoteDuterte https://t.co/266UpSfNUt"
duterte007,"MAKA MAR PALA YUNG ARROGANT UPLB STUDENT NA NAG TANONG KAY MAYOR DIGONG.
#friendshipsaanakniLeni

#PHVoteDuterte https://t.co/nzo2GJjYQG"
c__maldonado,I hope UPLB can expel those students who gave stupid questions to Duterte. Pabibo lang eh na wala sa lugar.
gisellerose8888,Taga UPLB man unta.  Peru murag grade 1 section 20 ang QUESTION.. Ahahahha. Kaluka kayo mga naturingang... https://t.co/KkcRYO7SDY
ItsHeraaa,"Oh my god. Nakkapikon yung uplb student, ikaw ang pinaka bobo nilalang"
gooGLEn_n,gusto ko manuntok . pwd pakihanap yung tiga UPlb? haha #DU30
4Duterte,Is he the Stephen Villena who asked Duterte when he visited UPLB? https://t.co/kN0i2LVOyZ
_ivannnnn,UPLB looks so much better during mornings. #uplb #vsco #vscocam #vscophile #vscoph @ Universityﾅ https://t.co/LjzHWVF5oo
erorbe,"To the UPLB student who asked the useless question: dude, stop studying. I'm wasting my tax money para sa walang modo na kagaya mo."
JammieNielsen_,@Jyhdelmae jy UPLB ka dba?
shaanggxx,Ang tataas ng tingin ko sa estudyante ng UPLB kasi ang alam ko lahat sila don matatalino tas ganto? Hahaha lakas... https://t.co/QWfxkWKxeR
TupasTooSlow,@Jyhdelmae yan yung upLB student na nagask kay duterte ng question noh?
Tywamon,Opinions regarding the issue between duterte and the uplb student???
RealAllen17,@ UPLB earlier with @dreiespartss &amp; @joshdg_11 <ed><U+00A0><U+00BD><ed><U+00BA><U+00B2> https://t.co/KdgygwxSRp
iamalexjt,What a rude UPLB student. He didn't even give Mayor Duterte the chance to finish answering his question. Such a disgrace for his school.
godPhoebusMagno,That was a misleading vid came from Rappler jd diay. Rappler must apologize to the student. First i judged directly daun sa UPLB stud. Sorry
GenesisBanawaaa,Sana pumunta din si @senmiriam sa UPLB :)
stxrmpilxts,Im trying to understand what that UPLB student was implying.
petlove2,This is so rude dude! I am also from UPLB but during our times mas  magulo pa dahil kasagsagan ng edsa dos but we... https://t.co/MKOGLQEcny
nems5669,"Becoz UPLB students asked good questions &amp; were serious about the whole exercise, unlike their ""guest""!  https://t.co/5bnf6DnLus"
xtiantuzon,A round of applause for Ms. Baraoidan's stand about the DU30 and a UPLB stud's issue.
duterte007,"MAYOR DUTERTE'S RESPONSE ON ARROGANT UPLB STUDENT.

https://t.co/tKhawWRVWf

#PhVoteDuterte 
#pilipinasdebate2016"
iyenixx,Hindi na yata mawawala ang mga bashers tuwing may GE conversation ang isang famous political figure sa UPLB. #sadtruth
PirtiKaEmotero,TAGA UPLB PA NAMAN KANG BAYOTA KA!!PERO BOGO KAY KAG PANGUTANA!!BANTAY LANG KANG BUANGA KA!PAG AMPO GYUD DI MODAOG SI DIGONG! #PHVoteDuterte
4Duterte,"Hi UPLB student Stephen Villena
Ds s Duterte's answr 2ur question
btw, he knows its a silly questn
Ayw k lng hiyain
https://t.co/equAJtXpez"
ohhMJCainglet,"Exactly. However, UPLB was able to figure out that person already. https://t.co/XgzSFcX7Gl"
chumpaddy,UPLB https://t.co/hA1q1oKoGU
xpeanutgalleryx,"""Nagulat po ako na hindi pala siya straightforward sumagot. iyong mga sagot niya po medyo malabo."" 
https://t.co/YkWtOoLPsF #phvoteduterte"
irvinvicencio,bastusa nung student from UPLB oy. Besh sinsira mo ang pangalan ng UP. Jusko uwi!
reinantonio,"That UPLB student is bastos, not UPLB students in general. But regardless of how a student acts, will still... https://t.co/LF0BXrPqLH"
kikobolinao,Hindi ako MakaDuterte pero ang tanga lang nung tanong nung UPLB student. Malamang. Compromise tlga budget ng isang sector if nafocus 1/2
SalvadorEdgaaar,Nyora @Senyora napanood mo na pangbabastos ng UPLB Student kay Mayor Du30? Ano masasabi mo? <ed><U+00A0><U+00BD><ed><U+00B8><U+0088>
thirdyglino,"Duterte supporters hit a UPLB student for being ""rude"" to Mayor Digong in a forum. But they cheer Duterte for cursing people."
voldylorde,an alumnus from my school lowkey roasted du30 at uplb <ed><U+00A0><U+00BD><ed><U+00B8><U+0082>
NheneRosalie,Duterte visit UPLB#PHVoteDuterte #DuterteVisitsUPLB https://t.co/ZZGwFXM6bd
yourfrantasy_,Saw the Video of mayor Duterte's open forum with UPLB students
DuterteFtheWin,Ang hambog at disrespectful nung UPLB student. Si Mayor na nga yung tinatanong nya ganun na umasta paano pa kaya kung ibang tao yun?
PirtiKaEmotero,grabe naglagot ko atong taga UPLB nga bastos kaayo kang Mayor bah.ha man imong breeding?.waka tudloi saimong mga ginikanan?! #PHVoteDuterte
markmillare,lamia ligsan atong studyante sa uplb oy
thrshaa,"Not all UPLB students are, like many have said, arrogant. On the other hand, not all bisaya people are pro-Duterte."
lcconchas14,@lcconchas14 *UPLB Student
PirtiKaEmotero,"Nyeta yung taga UPLB na nagtanong kay Digong ah, di man lang nahiya bilang natagurian pa naman skolar ng bayan..#PHVoteDuterte"
micahtorres_,"Napaka walang modo nung taga UPLB, I get it that u don't like du30, but damn can't u ask in a nice way? wala pa nararating, mayabang na agad"
Mharrrrrrr,Kakahiya naman ung mga studyante ng UPLB na un wtf
Xiannethomonas,Bugua atong estudyante sa UPLB oy! May pa compensate2 pang nalalaman. Patunlon kag bomba ron buanga ka <ed><U+00A0><U+00BD><ed><U+00B2><U+00A3>
avadakathavra,bastos na gusto ng uplb student ng straightforward na sagot pero hindi bastos yung mga putangina ni duterte sa forum? hmm hahaha
ReclaimEDSA,"Simpleng utos lang, di masunod ng supporters ni Duterte. #PHVoteDuterte #DuterteVisits UPLB https://t.co/TUp1vtTTr0 https://t.co/APUTvJdDc0"
ABlessingToYou,Seeing Davao City related pages online and their wrath against that UPLB student breaks my heart. Di po lahat ng nag-aaral sa UPLB ganun. <ed><U+00A0><U+00BD><ed><U+00B8><U+0094>
lcconchas14,"Re sa video ng UPLB vs Duterte, what if kung si Binay yung nagisa?"
edward_rico,"""Bastos"" daw yung ginawa nung UPLB student kay Duterte pero okay lang gawan ng meme at murahin si Mar? <ed><U+00A0><U+00BE><ed><U+00B4><U+0094>"
Judaaah,Gago yung UPLB student na naka-usap ni Duterte. Ubod ng tanga. Ngayon ko lang napagtanto na di lahat ng nag-aaral sa UP matalino.
Jenicaibit,"UPLB student kapa sa lagay na yan ahh! Booooo, walang may paki sayo kuya <ed><U+00AE><U+00B8><ed><U+00BC><U+00BD><ed><U+00AE><U+00B8><ed><U+00BC><U+00BD><ed><U+00AE><U+00B8><ed><U+00BC><U+00BD> ang epal mo ehhh! https://t.co/goxJPBZ2QY"
zekenava,Have you seen the video of the uplb student who make duterte feel humiliated and arrogant? Kainis
justmark8,I think fellow #Digong supporters should not bash the personality of that rude student in #UPLB. It's enough to criticize his act...
cjaampig,Ahm https://t.co/cZaxhu8WhG
francesmonsanto,@finiarmea yes medyo disrespectful siya tapos na-generalize na mga taga-UPLB <ed><U+00A0><U+00BD><ed><U+00B8><U+009E>
youronlyprince6,Ah okay ganito pala sa UPLB . Nadismaya ako ..  Yung skul na pinapangarap ng karamihan kasi nga UP yan may iilan... https://t.co/OOHCRYXhk7
DeguzmanNini,Sino b tong bastos na student from #uplb sinisira mo pangalan at karangalan ng up
bingzhie,Kanina nakitkita ko pa acft ni #stephenvillena ng UPLB ah.. Ngaun la na.. Coward mo naman.. #stephenvillenaRUDE
migspretty,@missjover hindi lang ikaw. Pati si Mr. UPLB Student na nagtanong - victim of cyberbullying na
theredberry80,@bum_tenorio Im a UPLB grad too BS Food Tech. Not been back for a long time. Miss UPLB
dewlyy,grr<ed><U+00A0><U+00BD><ed><U+00B8><U+00A1><ed><U+00A0><U+00BD><ed><U+00B8><U+00A1>annoying yung UPLB student.sge insist mo pa yang pagmamagaling mo.
clongshit,Kawawang UPLB student <ed><U+00A0><U+00BD><ed><U+00B8><U+0082>
clavenilo,@maria_ressa @leahnavarro @rapplerdotcom this country future may pag asa Go UPLB !!
arveen11,"Binay in UPLB - Roasted
F�hrer Duterte in UPLB - Didnt directly answered the question. Nabash pa yung student."
CharlieCinon,That beki UPLB student deserves to be humiliated online. <ed><U+00A0><U+00BD><ed><U+00B8><U+0082>
dreiespartss,Jgh from uplb
ivanthebelly,"We do not crave for Duterte, we crave for Miriam! (@senmiriam) - most UPLB students #MiriamFight #SiMiriamAngSagot #MDS2016"
diafricano,I want to hear the side of UPLB students. Ano ba talagang nangyari sa forum with Mayor Du30?
KRlSSl,"gago ka ba @rapplerdotcom?????

ano fallacy pa? hasty generalization? fallacy of composition?? sige lahatin mo na kaming uplb students :---)"
jandeybpogi,Ang bobo noong taga-UPLB na nambastos kay Duterte HAHAHAHAHAHA ANG SHALLOW HAHAHAHAHA
thrshaa,"@thrshaa i mean, between people's hasty generalization of uplb students and people's usual perception of bisaya people"
jadine_uplb,"Prolonging the agony but still.. go @JayeHanash <ed><U+00A0><U+00BD><ed><U+00B2><U+009A>

REIDY TO WIN https://t.co/MakQrBZ8kD"
aymgw,uy diba ayaw ko kay duterte pero grabe naman yung uplb student na sinagot sagot siya ng ganon. mayor yang kaharap mo haha respeto naman
4Duterte,"@belligerentmiss No, pls dont drop names. No name was mentioned in d vid for d rude person who interrupted Duterte in UPLB."
AmAries09,Bastosa atong uplb student oy. Murag way utok ba
dri_go1003,"May karamay ka sa pagbangga raw kay Duterte. <ed><U+00A0><U+00BD><ed><U+00B8><U+0082>
#JPdelasNievas #ronaldgemcelestial #uplb #Rappler https://t.co/iacRnsGUeD"
4Duterte,"@she8happens No, pls dont drop names. No name was mentioned in d vid for d rude person who interrupted Duterte in UPLB."
4Duterte,"@Ideal_Views @YouTube No, pls dont drop names. No name was mentioned in d vid for d rude person who interrupted Duterte in UPLB."
4Duterte,"@ohhMJCainglet 
No, pls dont drop names. No name was mentioned in d vid for d rude person who interrupted Duterte in UPLB."
jadine_uplb,"@NickAwards2016 @JayeHanash <ed><U+00A0><U+00BD><ed><U+00B2><U+009A>

REIDY SET SLIME"
trettet,Wow...i now see why people are outraged towards UPLB... <ed><U+00AE><U+00B8><ed><U+00BC><U+00A0><ed><U+00AE><U+00B8><ed><U+00BC><U+00A0> https://t.co/RRScbDVEkg
aicamercado_,UPLB students again in bad light bc 1) media framing strikes again and 2) we're called 'arrogant &amp; disrespectful' bc of that one student. <ed><U+00A0><U+00BD><ed><U+00B8><U+00B6>
jadine_uplb,"Congrats @hellobangsie <ed><U+00A0><U+00BD><ed><U+00B2><U+009C>

REIDY SET SLIME https://t.co/ruWGVhD6Au"
ivanthebelly,What if Miriam visits UPLB? What would you do? <ed><U+00A0><U+00BD><ed><U+00B2><U+0099><ed><U+00A0><U+00BD><ed><U+00B2><U+0099><ed><U+00A0><U+00BD><ed><U+00B2><U+0099>
VaritBruten,Bugo lagi tong nangutana kay Duterte nga taga UPLB. Walay respeto.
Greeeeyyyss,@TheTweetsOfRjel Oh. Concern lang ako sa mga supporters niya na nangbbash ng UPLB students. Rage mode on.
ginajane19,"Dear UPLB, ang HARD nyo."
musargelyy,"@clintzoned @haidilizatomy chill bruh, mainit ang tingin ng social media sa mga uplb kaya bias sila"
alexbarcy,Hindi nga kasi si Gem yung UPLB student ano ba guys paano ba kayo mangstalk ng profile
SoEJSabado,UPLB students to Duterte: Give us direct answers https://t.co/DmubFrHj0i via @rapplerdotcom
_NoChillC,"umagang-umaga puro UPLB bashing headlines and comments ang nakikita ko.. hasty generalizations and shits, kastress tong mga to jusko <ed><U+00A0><U+00BD><ed><U+00B9><U+0084>"
manongedu,Sobrang tanga nung UPLB student na yon.
JoanaDCruz,"Wala pala kayo uplb e, bastos pala kayo e hahaha"
CeejaeRafanan,Ugh yun UPLB student is now being cyberbullied by Duterte supporters. CONTEXT NAMAN GUYS check nyo muna CONTEXT
SiAyVan,"That UPLB student had a good question but was rude in saying, ""Para makauwi na po kayo."""
angelavrns,Uplb pa sa sabado yay
HeneralLUJna,ako ray naluoy sa UPLB student na nagpinataka ug pangutana ahahaha. or basin poser ra
paulrelampagos,Must remember to watch this UPLB thing later
ChinkyFreddie,The steph pablo guy from UPLB should be the cover art for Kanye West's new abum The Life Of Pablo. <ed><U+00A0><U+00BD><ed><U+00B8><U+0082><ed><U+00A0><U+00BD><ed><U+00B8><U+0082><ed><U+00A0><U+00BD><ed><U+00B8><U+0082>
MeChieeeee,"Nakakairita yung uplb student, tangina mamaru masyado e. Di muna patapusin sa pageexplain si duterte, in-interrupt agad."
heathstrife,That UPLB student though. Hahahahaha. Pasikat e nagmukha namang tanga. #ChangeIsComing #Duterte2016 #PHVoteDuterte
kingpatrickva,Kuyang tga UPLB kung katulad mo lng nmn ang pglalaanan ng budgt para sa edukasyon e wag na lang.
jadine_uplb,"HAHAHAHAHA

REIDY SET SLIME https://t.co/9xIWcYQ90S"
jadine_uplb,"@NickAwards2016 We were born REIDY! <ed><U+00A0><U+00BD><ed><U+00B8><U+0089>

REIDY SET SLIME"
Surrearlism,"At rest.

#nature #uplb #sky @ Freedom Park https://t.co/K3nXn4u745"
steveaokier,"""UPLB student as a teacher""

Teacher: *hands test papers*
Teacher: Get one and pass pakisagot agad ng tanong ko para makaalis na kayo."
DuterteFtheWin,@EscobalJessie sa UPLB ni?
jadine_uplb,REIDY SET SLIME https://t.co/BgKIDKTFK5
akositurat,"Sharing this important open letter from the current UPLB USC Chairperson, Ronald Gem Celestial. Btw, happy... https://t.co/O2r6EGB4MW"
taddybearl,that autistic UPLB student deserves to be humiliated online
DudeItsGAB,Just posted a photo @ UPLB Freedom Park https://t.co/kjOl6LbD80
lexiizzlee,Bias nyo Rappler. Pucha!!ﾠ. Commented on: UPLB students to Duterte: Give us direct answers: https://t.co/bEbvN2Zzw7
itsyownis,UPLB <ed><U+00A0><U+00BD><ed><U+00B8><U+008D> (c) https://t.co/duq73B2WqI
bautistawhenie,@bautistawhenie kay kuyang taga UPLB god bless you.
soybin_11,Di ka kawalan sa uplb. <ed><U+00A0><U+00BD><ed><U+00B6><U+0095><ed><U+00A0><U+00BC><ed><U+00BF><U+00BD><ed><U+00A0><U+00BD><ed><U+00B8><U+00A1> masyadong pabida.
timtimvalenzz,"ready na kami for tedxadmu!!! 
uplb cdc reprezentttt <U+2728>
@jangkido @callmejohnd @pauzpgan @KLPeroy"
AlvinRiamon,UPLB students disappointed Duterte answered just four questions in forum https://t.co/x92BXou2Bm via @gmanews
finiarmea,I've been reading posts and comments regarding the UPLB student who disrespected Duterte last friday...
Rextituts,UPLB students to Duterte: Give us direct answers https://t.co/1YTETZzo4P #duterte #eleksiyon2016
steveaokier,That UPLB student clearly wanted to keep up their school's image when they grilled Binay last year. Paandar din naman talaga kayo eh.
yoitsmeCAEL,My tita opened up the issue about kay kuyang nagtanong and Duterte and she's really blaming the UPLB students na bakit daw ambabastos.
karlaloveskakay,Haaay! MakaBV ang UPLB student na gapatakag sturya! <ed><U+00A0><U+00BD><ed><U+00B8><U+00A1><ed><U+00A0><U+00BD><ed><U+00B8><U+00A3>
MariellaNato,Seriously? Yung taga uplb student na binastos si mayor duterte nakakapang init ng dugo. Naturingan up student! Walang respeto.
yoitsmeCAEL,Ano kayang pokemon yung meron sa UPLB? hahaha
RonaldGem,@kentilogon It was the UPLB community's collective effort. :)
shanederella_,Nahigh blood ako ni kuyang taga-UPLB student haha. Ngayon lang ulit ako nag rant sa fb.
jadine_uplb,"ARE YOU REIDY?

REIDY SET SLIME <ed><U+00A0><U+00BD><ed><U+00B2><U+009A>"
Trickzanity,That disrespectful student from UPLB tho. Smh.
jpeugeni0,siguro nag trending yung eatudyante mula sa UPLB. hahaa. sagot pa.
alwaysGARCIfied,UPLB students disappointed Duterte answered just four questions in forum https://t.co/uH4qQVpIxb
yeapaulee,"Ung student ng UPLB, nagtanong lng para makapagbara eh. Oh eto na hinhiling mo, sikat kana. Okay na?"
barcy41479,@ArbetBernardo Good question from the UPLB student. Disappointing that Duterte didn't give a clear &amp; direct answer.
kentilogon,Na amaze ako kung gano ka active and very successful ang student council ngayon ng UPLB. char hahaha Happy Birthday kuya @RonaldGem
migspretty,"@xpeanutgalleryx in other news, have you seen meme bashing UP Student who asked duterte a question at uplb? ""Arrogant"" daw ang bata."
araneta_irene,@PHVote @RRD_Davao @YouTube  nakaka disappointed ang mga  student ng UPLB pasalamat tayo mayrong #Duterte2016  nahandang mag buwis buhay
hananeel,Tinutuon ko ang isip ko sa Manila major dahil sobrang nakakapanggigil ang sinasabi ng mga tao sa mga nagtanong kay Duterte sa uplb.
Nachelleee,@accuxiidia @jadine_uplb @JaDinexWolves @JeyeHanash @TeamKaBebe eto na naman haha https://t.co/83fpxM31ga
PipinoNiJobert,"Yung estudyante ng UPLB, sa sobrang katalinuhan, ganun nalang mambastos. Halatang kulang sa pagmamahal. BIGYAN NG PIPINO!!"
akositurat,@kloreine ay UPLB ka lang ate? Hahaha
kloreine,"Gusto ko talagang manapak minsan kapag sinabing ""Ah UPLB lang?"" <ed><U+00A0><U+00BD><ed><U+00B8><U+0091>"
mikezamora20,that rude UPLB student is a shame to the academe.
joycilindrawing,I swear di na ko babalik sa UPLB. Never ever!!
Mthyll,Sana upload na ng rappler yung forum ni Duterte sa UPLB. May tangang studyante kasi ang hindi marunong makinig <ed><U+00A0><U+00BD><ed><U+00B8><U+0082> #PHVoteDuterte
Ideal_Views,Mayor Duterte's Reaction to UPLB student: It was a bit silly question #PHVoteDuterte https://t.co/ZDVBoSnNrV via @YouTube
fremsite,@Senyora eto ung nambastos kay Mayor Duterte sa UPLB gustong magpasikat.. pasikatin mo nga<ed><U+00A0><U+00BD><ed><U+00B8><U+008F>@VillenaStephen https://t.co/mR3h9h7HWw
fremsite,ayan ang UPLB student na nambastos kay Mayor Duterte<ed><U+00A0><U+00BD><ed><U+00B8><U+00A1> https://t.co/g6fLgCrJIC
lukesKYLEwalker,"UPLB student vs Duterte,  winner Duterte hahaha"
garnerlagare,UPLB student na nambastos kay #DUTERTE take your take to listen to this video that explains the answer  to your... https://t.co/1Rc2H12Kk2
tonyeagler,I thought if u came from a state U like UPLB makes u a better stud. This 1 is arrogant. Sorry for ur parents dude.  https://t.co/DwTrVgPKNS
ABlessingToYou,"UPLB Students are now being generalized as ""Rude"" students because of that Duterte incident last March 11. <ed><U+00A0><U+00BD><ed><U+00B8><U+0094>"
ansoyming,cc arrogant and disrespectful UPLB kid (kaway kaway!)
opinionatedjp,"I wonder how this UPLB student Stephen Villena able to enroll UP. Aside from grades, GMRC shud also be considered! https://t.co/zP962JGo8z"
mescasa,"The full speech at UPLB. 
https://t.co/SXeUgOz3pP"
29cess,Nakakahighblood ung studyante sa uplb<ed><U+00A0><U+00BD><ed><U+00B8><U+0092> ampota kung ganyan ka mag defense kay mam cortez masisingko ka<ed><U+00A0><U+00BD><ed><U+00B8><U+0082>
CyberChangge,Mayor Duterte's Reaction to UPLB student. I guess this will answer ur question. I rest my case #PHVoteDuterte <ed><U+00A0><U+00BD><ed><U+00B1><U+008A><ed><U+00A0><U+00BC><ed><U+00BF><U+00BB> https://t.co/RTXt8I9efX
garnerlagare,This rudeness made by one student of UPLB does not affect the whole UP population because we all know that their... https://t.co/H69ydYPGFQ
natibk3r,"So, it seems that UPLB studes are dismayed with #Duterte https://t.co/6LzDMGhYb1"
thetigeRAD,@cJeyp Marami naman na unang pinili ang UPLB. T'saka argumentum ad hominem 'yun e. Tanga lang siya? Haha.
albarrientos21,Pero hay arrogant uplb students tsk
rejilistic,"hhmm. iba talaga yung dating ni kuyang taga UPLB. he is aggressive, not assertive"
IAMKHALIDLOZANO,Oohh that exchange between Duterte and one UPLB student <ed><U+00A0><U+00BD><ed><U+00B9><U+0088>
cutechikkadoll,Hayaan na natin ung UPLB student who was 'rude' during the Q&amp;A and let's not do hasty generalization. <ed><U+00A0><U+00BD><ed><U+00B1><U+008D> #DuterteVisitsUPLB #PHVoteDuterte
Jimparedes,"https://t.co/Er362fCJ0V
Some UPLB Students who questioned Duterte were criticized by Netizens for being disrespectful &amp; rude."
CLbeboso,Arrogant man ng UPLB! HAHAHAHAH kakahiya kuya hahaha
IamChadPlacer,"Kala ko may problem don sa UPLB with Duterte, ang babaw naman pala. Napanuod ko sya parang tambay naman yung mga... https://t.co/bqAUnBBeZJ"
jadine_uplb,"@joycelovegonza2 thank you loves! <ed><U+00A0><U+00BD><ed><U+00B2><U+009C>

REIDY SET SLIME"
mCkey_Alcuizar,Pasikat na uplb ..... Ahahahahah bulok .... Tukmol https://t.co/zL73qdb2GS
ricolocco,"@aaoreas nope - walang pwedeng umasta ng ganun kayabang. Sorry for that tweet. Dapat: ""Ang yabang nitong UPLB student na to."""
ricolocco,"@FudgerBadger yup. Agreed. Sorry for that tweet. Dapat: ""Ang yabang nitong UPLB student na to."""
Ideal_Views,Some UPLB Students who questioned Duterte was criticized by Netizens for being disrespectful &amp; rude  #PHVoteDuterte  https://t.co/JlHozHWBvH
joycelovegonza2,"@jadine_uplb Goodmorning ;) excited for the results later , for the twitter party later . Have a. Blessed Sunday"
JandellG,"To that particular UPLB student, one word: Bastos."
